title,summary,url,annotation
First Data,"A first date is the initial meeting during the dating process of two individuals, in which an effort is made to ask about each other, plan a potential relationship, and/or organize some sort of romantic activity. Aims vary between finding a romantic, platonic, or sexual partner for a short period, to finding a long-term spouse. Dating can vary between cultures, lifestyles, religion, gender, and sexual orientation.
In many countries and cultures, it is the process that romantic relationships are developed and future spouses are found. Some people go on first dates to evaluate a person's potential as a sexual partner. Often, people have dates arranged for them by their friends, or they meet the individual at work, a party, in class, in their community or online on a social media website or dating website. During the date, each participant can evaluate the compatibility of the other person and get the opportunity to screen out individuals who engage in behaviour that a person does not prefer.
There are many possible outcomes on the conclusion of a first date. The two individuals may agree to a second date. One or both parties may decide that there are incompatibility issues and decide not to pursue further dates. Compatibility factors vary a great deal, and can include religion, whether or not a person uses drugs or alcohol, appearance, or personality. Alternatively, the two parties may decide to become friends or some other type of Platonic relationship (a non-sexual relationship). Some first dates may lead to a romantic relationship that can range in duration from short period to a long period.

",https://en.wikipedia.org/wiki/First_date,Not an Event
Institute of Directors (India),"The Institute of Directors (India) was established in India on 12 July 1990, as a not-for-profit, apex association of Directors under the India's 'Societies Registration Act XXI of 1860' to improve their professional competence. It has since grown to associate with more than 30,000 leaders from Govt, PSU and Private organisations.
Over the years, the Institute of Directors, India, has been debating on a number of Boardroom issues for their Governance, Development, Sustainability and Inclusive Growth. IOD, India is committed to its endeavor of building boards of the future. The IOD, India's activities extend from Boardroom Trainings, Researches, Publications, Board Advisory Services and Monthly Lectures to Workshops and networking of Members, Directors and Global Leaders through various National & International Conventions and platforms to debate the issues of topical interest, held in India, and abroad. 
Over the last 30 years, IOD, India has been organising its annual Global Conventions in India, Dubai, Singapore, London and Europe focusing on various boardroom issues and also the Global Business Meets by bringing together industry leaders, policy makers and board members from various parts of the world.

",https://en.wikipedia.org/wiki/Institute_of_Directors_(India),Not an Event
Museum railway station,"Museum railway station is a heritage-listed underground commuter rail station that is located on the City Circle route at the southern end of Hyde Park in the Sydney central business district of New South Wales, Australia. The station is served by Sydney Trains' T2 Leppington & Inner West Line, T3 Liverpool & Inner West Line and T8 Airport & South Line. The station is named after the nearby Australian Museum. It was added to the New South Wales State Heritage Register on 2 April 1999.

",https://en.wikipedia.org/wiki/Museum_railway_station,Not an Event
Butterweed,"Butterweed is a common name for several plants and may refer to:

Conyza, a genus native to eastern Asia and North America
Packera glabella, a species native to central and southeastern North America",https://en.wikipedia.org/wiki/Butterweed,Not an Event
SPINLW1,"Eppin is a protein that in humans is encoded by the SPINLW1 gene.
This gene encodes an epididymal protease inhibitor, which contains both kunitz-type and WAP-type four-disulfide core (WFDC) protease inhibitor consensus sequences. Most WFDC genes are localized to chromosome 20q12-q13 in two clusters: centromeric and telomeric. This gene is a member of the WFDC gene family and belongs to the telomeric cluster. Alternatively spliced transcript variants encoding distinct isoforms have been found for this gene.",https://en.wikipedia.org/wiki/SPINLW1,Not an Event
"Embassy of Sweden, New Delhi","The Embassy of Sweden in New Delhi is Sweden's diplomatic mission in India. The embassy is headed by the ambassador of Sweden to India. The embassy is situated in Chanakyapuri, the diplomatic enclave of New Delhi, where most of the embassies in India are located. The Swedish embassy is responsible for the honorary consulates in India, located in Kolkata and Chennai, and the Swedish consulate general in Mumbai. The ambassador of New Delhi is also accredited to Sri Lanka, Nepal, Bhutan and Maldives.","https://en.wikipedia.org/wiki/Embassy_of_Sweden,_New_Delhi",Not an Event
New Jersey Folklore Society,"The New Jersey Folklore Society is an academic organization that formed in an attempt to spread awareness about folklore. The group took trips throughout New Jersey and produced a yearly publication.

",https://en.wikipedia.org/wiki/New_Jersey_Folklore_Society,Not an Event
Germany–Montenegro relations,"German-Montenegrin relations are foreign relations between Germany and Montenegro.  Both countries established diplomatic relations on 14 June 2006. Germany has an embassy in Podgorica.  Montenegro has an embassy in Berlin and a general consulate in Frankfurt.
Both countries are members of NATO and Council of Europe. Also Germany is an EU member and Montenegro is an EU candidate.
In 1997 the German Bundeswehr used the Podgorica Airport for the Operation Libelle, which led to the first skirmish involving German forces since World War II.
And Germany is Observer bureau of the BSCE and Montenegro is with Slovenia  is a Sectoral dialogue partner countries of BSCE.",https://en.wikipedia.org/wiki/Germany%E2%80%93Montenegro_relations,Event
Julie and the Phantoms (soundtrack),"Julie and the Phantoms: Music from the Netflix Original Series is the soundtrack album of the American musical comedy-drama web television series Julie and the Phantoms. Both soundtrack and series were released on September 10, 2020.  The album reached number 1 on both the US and Australian iTunes charts and peaked at number 4 on the US Billboard Soundtrack chart.

",https://en.wikipedia.org/wiki/Julie_and_the_Phantoms_(soundtrack),Not an Event
Glucagon receptor,"The glucagon receptor is a 62 kDa protein that is activated by glucagon and is a member of the class B G-protein coupled family of receptors (secretin receptor family), coupled to G alpha i, Gs and to a lesser extent G alpha q. Stimulation of the receptor results in the activation of adenylate cyclase and phospholipase C and in increased levels of the secondary messengers intracellular cAMP and calcium. In humans, the glucagon receptor is encoded by the GCGR gene.
Glucagon receptors are mainly expressed in liver and in kidney with lesser amounts found in heart, adipose tissue, spleen, thymus, adrenal glands, pancreas, cerebral cortex, and  gastrointestinal tract.",https://en.wikipedia.org/wiki/Glucagon_receptor,Not an Event
"Milburn, Nebraska","Milburn is an unincorporated community in Custer County, Nebraska, United States. It is located within the boundaries of the 68813 Zip code, serviced out of Anselmo, Nebraska. It is also located at the northwestern edge of the Milburn Township boundary. It is in Nebraska State Senate district 43.","https://en.wikipedia.org/wiki/Milburn,_Nebraska",Not an Event
List of FAW vehicles,"This is a list of current and former automobiles produced by Chinese state-owned automaker China FAW Group (abbreviated as FAW), under its brands of Hongqi, and Bestune.

",https://en.wikipedia.org/wiki/List_of_FAW_vehicles,Not an Event
Amak Island,"Amak Island (Aleut: Amax; Russian: Амак) is an uninhabited island in Aleutians East Borough, Alaska, United States. The island lies north of the western tip of the Alaska Peninsula, and northwest of the mainland city of Cold Bay. The island's land area is 5.828 square miles (15.09 km2) and its maximum elevation is 1,601 feet (488 m). The island's volcano, Mount Amak, last erupted in 1796.
The local population of the song sparrow was last seen on the island around New Year's Eve, 1980/1981, and has not been seen since; devegetation of the island played a part in its demise. These birds were formerly considered a separate subspecies, Melospiza melodia amaka, but are now considered to fall into the range of variation of the Aleutian song sparrow (M. m. sanaka). Unconfirmed reports from the late 1980s suggest that the island, should habitat quality improve, would in time be recolonized by the species.",https://en.wikipedia.org/wiki/Amak_Island,Not an Event
Sabzevar,"Sabzevar (Persian: سبزوار; ) is a city in the Central District of Sabzevar County, Razavi Khorasan province, Iran, serving as capital of both the county and the district.",https://en.wikipedia.org/wiki/Sabzevar,Not an Event
"Taki House, Govt Sponsored Multipurpose School for Boys","Government Sponsored Multipurpose School (GSMS) for Boys, Taki House is a school in Kolkata, West Bengal, India. Its main campus is located in 299B Acharya Prafulla Chandra (APC) Road, Kolkata, started in the year 1965.","https://en.wikipedia.org/wiki/Taki_House,_Govt_Sponsored_Multipurpose_School_for_Boys",Not an Event
Phyllodrepa ioptera,Phyllodrepa ioptera is a species of rove beetles native to Europe.,https://en.wikipedia.org/wiki/Phyllodrepa_ioptera,Not an Event
Women's health in Ethiopia,"Women's health in Ethiopia can be broken down into several sections: general health status, women's status, maternal health,  HIV, harmful traditional practices, and violence against women.",https://en.wikipedia.org/wiki/Women%27s_health_in_Ethiopia,Not an Event
Dweep,"Dweep is a puzzle game published in 1999 by Dexterity Software.

",https://en.wikipedia.org/wiki/Dweep,Not an Event
Lobster sauce,"Lobster sauce is a type of sauce used in American-Chinese and Canadian-Chinese cuisine.  It is also sometimes found in Polynesian-influenced Chinese food. It is a type of ""white sauce"" within Chinese cooking, meaning that it is mild and based on meat stock as opposed to soy sauce.

The sauce itself does not contain any lobster, and may vary in preparation method from place to place or restaurant to restaurant. It can contain chicken broth, garlic, ginger, green onions, fermented black beans, and eggs, and is thickened with starch.  Some recipes incorporate pork mince and soy sauce.  The colour varies from being pale white to brown, or to a yellow, depending on the quantity of soy sauce used and how the eggs are incorporated into the sauce.  Lobster sauce in most of New England, where it is a thicker, brown sauce, is the exception.",https://en.wikipedia.org/wiki/Lobster_sauce,Not an Event
Kualoa Airfield,"Kualoa Airfield is a former wartime airfield on Oahu, Hawaii. Part of it is now the Kualoa Regional Park.",https://en.wikipedia.org/wiki/Kualoa_Airfield,Not an Event
Twoism,"Twoism is the debut EP by Scottish electronic duo Boards of Canada, self-financed and released through their own Music70 record label in August 1995. Initially limited to 100 copies and released privately, the EP was reissued by Warp Records on November 25, 2002.
The EP led the duo to be noticed by Skam Records, resulting in the release of Boards of Canada's first major public EP Hi Scores in 1996 on Skam Records.

",https://en.wikipedia.org/wiki/Twoism,Not an Event
Neonympha areolatus,"Neonympha areolatus, the Georgia satyr, is a species of brush-footed butterfly in the family Nymphalidae. It is found in North America.
The MONA or Hodges number for Neonympha areolatus is 4576.",https://en.wikipedia.org/wiki/Neonympha_areolatus,Not an Event
Bonagota melanecta,"Bonagota melanecta is a species of moth of the family Tortricidae. It is found in Chimborazo Province, Ecuador.",https://en.wikipedia.org/wiki/Bonagota_melanecta,Not an Event
Te Kuiti railway station,"Te Kūiti is a town in the north of the King Country region of the North Island of New Zealand. It lies at the junction of State Highways 3 and 30 and on the North Island Main Trunk railway, 80 kilometres (50 mi) south of Hamilton. The town promotes itself as the sheep shearing capital of the world and is host to the annual New Zealand National Shearing Championships.
Te Kūiti is approximately 80 km south of Hamilton and 19 km south-east of Waitomo. The area around Te Kūiti, commonly known as the King Country, gives its name to the Heartland Championship rugby team based in Te Kūiti.

",https://en.wikipedia.org/wiki/Te_K%C5%ABiti,Not an Event
List of juju musicians,"This is a List of notable juju musicians in Nigeria.
There are numerous genres of music in Nigeria. Some genres such as Jùjú music, Fuji music, Apala and Were music are peculiar to certain ethnic groups.",https://en.wikipedia.org/wiki/List_of_juju_musicians,Not an Event
Hiraka Station,"Hiraka Station (平賀駅, Hiraka-eki) is a railway station in Hirakawa, Aomori, Japan, operated by the private railway operator Kōnan Railway Company.

",https://en.wikipedia.org/wiki/Hiraka_Station,Not an Event
Couts,"Coutts & Co.  is a British private bank and wealth manager headquartered in London, England.
Founded in 1692, it is the eighth oldest bank in the world. Today, Coutts forms part of NatWest Group's wealth management division. In the Channel Islands and the Isle of Man, Coutts Crown Dependencies operates as a trading name of The Royal Bank of Scotland International Limited. In 2021, Coutts achieved B-Corp status, becoming only the third UK bank to achieve the certification.

",https://en.wikipedia.org/wiki/Coutts,Not an Event
H2AFV,"Histone H2A.V is a protein that in humans is encoded by the H2AFV gene.
Histones are basic nuclear proteins that are responsible for the nucleosome structure of the chromosomal fiber in eukaryotes. Nucleosomes consist of approximately 146 bp of DNA wrapped around a histone octamer composed of pairs of each of the four core histones (H2A, H2B, H3, and H4). The chromatin fiber is further compacted through the interaction of a linker histone, H1, with the DNA between the nucleosomes to form higher order chromatin structures. This gene encodes a member of the histone H2A family. Several transcripts have been identified for this gene.",https://en.wikipedia.org/wiki/H2AFV,Not an Event
Yukon Regiment,"The Yukon Regiment was a short lived infantry regiment of the Canadian Army Reserve, currently on the Supplementary Order of Battle. The regiment originated in Whitehorse, Yukon on 19 March 1962, when 'The Yukon Regiment' was authorized to be formed. It was reduced to nil strength and transferred to the Supplementary Order of Battle on 15 June 1968. 

",https://en.wikipedia.org/wiki/Yukon_Regiment,Event
Volcanism of Canada,"Volcanic activity is a major part of the geology of Canada and is characterized by many types of volcanic landform, including lava flows, volcanic plateaus, lava domes, cinder cones, stratovolcanoes, shield volcanoes, submarine volcanoes, calderas, diatremes, and maars, along with less common volcanic forms such as tuyas and subglacial mounds.
Though Canada's volcanic history dates back to the Precambrian eon, at least 3.11 billion years ago, when its part of the North American continent began to form, volcanism continues to occur in Western and Northern Canada in modern times, where it forms part of an encircling chain of volcanoes and frequent earthquakes around the Pacific Ocean called the Pacific Ring of Fire. Because volcanoes in Western and Northern Canada are in relatively remote and sparsely populated areas and their activity is less frequent than with other volcanoes around the Pacific Ocean, Canada is commonly thought to occupy a gap in the Ring of Fire between the volcanoes of the western United States to the south and the Aleutian volcanoes of Alaska to the north. Even so, the mountainous landscapes of the Canadian provinces of Alberta, British Columbia, Yukon, and the Northwest Territories include more than 100 volcanoes that have been active during the past two million years and whose eruptions have claimed many lives.
Volcanic activity is responsible for many of Canada's geological and geographical features and mineralization, including the nucleus of the North American continent, known as the Canadian Shield. Volcanism has led to the formation of hundreds of volcanic areas and extensive lava formations across Canada. The country's different volcano and lava types originate from different tectonic settings and types of volcanic eruptions, ranging from passive lava eruptions to violent explosive eruptions. Canada has a rich record of very large volumes of magmatic rock called large igneous provinces, represented by deep-level plumbing systems consisting of giant dike swarms, sill provinces and layered intrusions. The most capable large igneous provinces in Canada are Archean greenstone belts estimated at 3.8 to 2.5 billion years old, containing a rare volcanic rock called komatiite.",https://en.wikipedia.org/wiki/Volcanism_of_Canada,Not an Event
Satu Mare Synagogue,"The Satu Mare Synagogue (Romanian: Templul Mare din Satu Mare), also known as the Decebal Street Synagogue, is a Neolog Jewish congregation and synagogue, located at 4 Decebal Street, in Satu Mare, Transylvania, Romania. 
The synagogue is included on the National Register of Historic Monuments in Romania.
Designed in the Moorish Revival style, the synagogue was completed in 1870.  It has a tripartite façade, with the prayer house and the temple beside the facade. In 2004, a Holocaust memorial was dedicated in the synagogue's courtyard.",https://en.wikipedia.org/wiki/Satu_Mare_Synagogue,Not an Event
Journal of Medical Biochemistry,"The Journal of Medical Biochemistry is a quarterly peer-reviewed open access medical journal covering research in medical biochemistry, clinical chemistry, and related disciplines. It was established in 1982 as Jugoslovenska medicinska biohemija, obtaining its current name in 2007. It is published by Walter de Gruyter on behalf of the Society of Medical Biochemists of Serbia.
The journal exhibited unusual levels of self-citation and its journal impact factor of 2019 was suspended from the Journal Citation Reports in 2020, a sanction which hit 34 journals in total.",https://en.wikipedia.org/wiki/Journal_of_Medical_Biochemistry,Not an Event
"Pawełki, Silesian Voivodeship","Pawełki [paˈvɛu̯ki] is a village in the administrative district of Gmina Kochanowice, within Lubliniec County, Silesian Voivodeship, in southern Poland. It lies approximately 6 kilometres (4 mi) north of Lubliniec and 59 km (37 mi) north-west of the regional capital Katowice.","https://en.wikipedia.org/wiki/Pawe%C5%82ki,_Silesian_Voivodeship",Not an Event
Phyllodactylus papenfussi,"Phyllodactylus papenfussi is a species of gecko, a lizard in the family Phyllodactylidae. The species is endemic to Mexico.",https://en.wikipedia.org/wiki/Phyllodactylus_papenfussi,Not an Event
Electoral results for the district of Ashford,"This is a list of electoral results for the Electoral district of Ashford in South Australian state elections from the district's first election in 1997 until the 2018 state election, when the seat was abolished allowing the 2016 electoral redistribution.",https://en.wikipedia.org/wiki/Electoral_results_for_the_district_of_Ashford,Event
North Fork Musselshell River,"The North Fork Musselshell River is a tributary of the Musselshell River, approximately 35 miles (56 km) long, in Montana in the United States.
It rises in the Lewis and Clark National Forest in the Little Belt Mountains in northeastern Meagher County, and flows south through Bair Reservoir, then southeast. It joins the South Fork to form the main branch of the Musselshell just west of county line with Wheatland County.",https://en.wikipedia.org/wiki/North_Fork_Musselshell_River,Not an Event
Cobra Skulls,"Cobra Skulls are an American punk rock band originally from Reno, Nevada, United States, but later based in the San Francisco Bay Area. They have released three studio albums, five EPs, and three 7"" splits.

",https://en.wikipedia.org/wiki/Cobra_Skulls,Not an Event
Sony Channel (Latin American TV channel),Sony Channel (commonly referred to on-air as Sony) is a Latin American pay television channel that broadcasts TV series and movies. It is owned by Sony Pictures Entertainment and distributed by Ole Distribution. It was the first pan-regional basic-tier channel that offered programming in English with Spanish subtitles.,https://en.wikipedia.org/wiki/Sony_Channel_(Latin_American_TV_channel),Not an Event
2004–05 Sheffield United F.C. season,"During the 2004–05 English football season, Sheffield United competed in the Football League Championship.",https://en.wikipedia.org/wiki/2004%E2%80%9305_Sheffield_United_F.C._season,Event
Dickson Interchange,"Dickson Interchange is a transport interchange in Dickson, an inner-northern suburb of Canberra. The interchange allows transfers between the Canberra Metro light rail network and local ACTION bus services. As part of the construction of the Civic to Gungahlin light rail line, a new $4 million bus interchange opened in 2018. The interchange was built on land compulsorily acquired by the ACT Government in 2015, the terms of which were not disclosed to the public. Construction allowed direct access for bus and pedestrian traffic between Northbourne Avenue and Challis Street, as well as accommodation for up to nine local bus routes, a new taxi rank, kiss and ride facilities and signalised pedestrian crossings. The new facilities became an important connection point for commuters under a redesigned timetable that integrated bus and light rail services in early 2019.
Between the station's opening and February 2020, 11% of all light rail passengers boarded or alighted at Dickson Interchange, making it the busiest intermediate station on the line.

",https://en.wikipedia.org/wiki/Dickson_Interchange,Not an Event
"Yeniler, Taşköprü",Yeniler is a village in the Taşköprü District of Kastamonu Province in Turkey. Its population is 127 (2021).,"https://en.wikipedia.org/wiki/Yeniler,_Ta%C5%9Fk%C3%B6pr%C3%BC",Not an Event
ABA League system,"The ABA League system or ABA/Adriatic League system pyramid is a series of interconnected competitions for men's professional basketball clubs in the Adriatic Basketball Association. The system has a hierarchical format with a promotion and demotion system between competitions at different levels.
The Adriatic Basketball Association comprises clubs from six countries in Southeast Europe, formerly Yugoslavia; Bosnia and Herzegovina, Croatia, Montenegro, North Macedonia, Serbia, and Slovenia.

",https://en.wikipedia.org/wiki/ABA_League_system,Not an Event
19th Venice International Film Festival,"The 19th annual Venice International Film Festival was held from 24 August to 7 September 1958.
No OCIC Award was given this year due to the ""unusual immorality"" of the films.

",https://en.wikipedia.org/wiki/19th_Venice_International_Film_Festival,Event
Lovecraft & Witch Hearts,"Lovecraft & Witch Hearts is a compilation album by English extreme metal band Cradle of Filth, released on 13 May 2002 by record label Music for Nations.

",https://en.wikipedia.org/wiki/Lovecraft_%26_Witch_Hearts,Not an Event
"Guilford, Virginia","Guilford is an unincorporated community in Accomack County, Virginia.
Mason House was added to the National Register of Historic Places in 1974.","https://en.wikipedia.org/wiki/Guilford,_Virginia",Not an Event
